{
  "schemaVersion": "1.0.0",
  "taskId": "BR-0005",
  "eventId": "EVT-20260823-001",
  "roleId": "RB-04",
  "producerActorId": "actor-rb-04",
  "status": "completed",
  "summary": "توپولوژی نسخهٔ کامل به هشت حوزهٔ محصول و دو سفر انتهابه‌انتها تقسیم شد. دامنه، مسیر کامل مشتری از کشف تا بازگشت تجهیزات، مسیر کامل مدیر از تنظیم موجودی تا بستن رزرو، و ده قابلیت متمایز را پوشش می‌دهد. این ساختار دقیقاً تصمیم مالک محصول برای نسخهٔ نهایی و ادامه تا نقطهٔ انتهایی را حمل می‌کند و ادعای پیاده‌سازی یا QA ندارد.",
  "findings": [
    "شیت قیمت‌ها پنج گروه تجهیزات ثابت و یک مدل پلکانی لباس تا ۳۰ دست را با دو نرخ آزاد و بوعلی نشان می‌دهد.",
    "شیت رزرو چند رزرو در یک روز، رزرو همهٔ وسایل، تحویل زودهنگام و وضعیت‌های پرداخت نهایی، پیش‌پرداخت، در انتظار و تغییر زمان را نشان می‌دهد؛ بنابراین مدل باید چند قلم، چند رزرو هم‌زمان و تاریخچهٔ وضعیت را پشتیبانی کند.",
    "تاریخ‌های منبع فاقد سال و ساعت دقیق‌اند؛ واردکردن آن‌ها به‌عنوان رزرو عملیاتی زنده ایمن نیست و باید به‌عنوان سابقهٔ مرجع یا پس از تعیین سال/زمان تبدیل شوند.",
    "دامنهٔ کامل هشت حوزه دارد: کاتالوگ و رسانه، موجودی و دسترس‌پذیری، قیمت و احراز بوعلی، رزرو و حساب مشتری، پرداخت و مالی، تحویل/بازگشت، عملیات مدیر، و گزارش/ممیزی.",
    "نقش‌های محصول عبارت‌اند از بازدیدکننده، مشتری احراز‌شده، مشتری واجد قیمت بوعلی، مدیر عملیات و مدیر ارشد؛ دسترسی مدیریتی باید علاوه بر ورود، با مجوز سمت‌سرور محدود شود.",
    "ده قابلیت متمایز برای نسخهٔ نهایی تعریف شدند: موجودی زنده بازه‌ای، قیمت دوگانهٔ شفاف، سازندهٔ پکیج مراسم، لیست انتظار خودکار، زمان‌بندی تحویل/بازگشت، پیگیری و تغییر سلف‌سرویس، یادآوری و تقویم، چک‌لیست دیجیتال تحویل/خسارت، تقویم تعارض مدیر، و تحلیل تقاضا/درآمد."
  ],
  "recommendations": [
    "سفر مشتری به ترتیب کشف تجهیزات، ساخت پکیج، انتخاب تاریخ/ساعت/تعداد، محاسبهٔ قیمت، ورود و احراز بوعلی، رزرو، پرداخت، تأیید، تحویل، بازگشت و بستن سفارش پیاده شود.",
    "سفر مدیر به ترتیب تعریف تجهیز و تصویر، ظرفیت و قواعد قیمت، تعطیلات، مشاهدهٔ تقویم تعارض، بررسی رزرو، ثبت پرداخت، هماهنگی تحویل، ثبت بازگشت/خسارت و گزارش روزانه پیاده شود.",
    "قواعد پلکانی لباس به‌صورت جدول دادهٔ قابل‌ویرایش نگهداری شوند و عددها داخل منطق برنامه hard-code نشوند.",
    "رزرو فقط پس از بررسی اتمیک ظرفیت ثبت شود؛ وضعیت پرداخت و وضعیت رزرو جدا اما با گذارهای معتبر و ثبت ممیزی نگهداری شوند.",
    "داده‌های تاریخی اکسل تا روشن‌شدن سال و ساعت به ناحیهٔ مرجع مهاجرت وارد شوند، نه به تقویم زنده."
  ],
  "acceptanceCriteria": [
    {
      "statement": "کاربر بتواند همهٔ تجهیزات منبع را ببیند، تاریخ، ساعت و تعداد را انتخاب کند و قیمت آزاد یا بوعلی را پیش از رزرو مشاهده کند.",
      "verification": "آزمون انتهابه‌انتها برای هر پنج تجهیز ثابت و همهٔ شش پلکان لباس، مبلغ و دسترس‌پذیری را با دادهٔ منبع تطبیق دهد."
    },
    {
      "statement": "یک رزرو کامل بتواند چند قلم تجهیز، بازهٔ تحویل و بازگشت، تعداد، نوع قیمت، اطلاعات مشتری و تاریخچهٔ وضعیت را نگهداری کند.",
      "verification": "آزمون API و پایگاه‌داده، رزرو چندقلمی، تغییر زمان، پیش‌پرداخت، پرداخت نهایی، لغو و بازگشت را بازخوانی کند."
    },
    {
      "statement": "سیستم از رزرو بیش از ظرفیت، بازهٔ تعطیل و تعارض هم‌زمان جلوگیری کند و لیست انتظار را پیشنهاد دهد.",
      "verification": "آزمون رقابت هم‌زمان و سناریوهای هم‌پوشانی، تعداد بیش از ظرفیت و روز تعطیل هیچ ظرفیت منفی یا رزرو دوگانه‌ای ایجاد نکند."
    },
    {
      "statement": "قیمت بوعلی فقط پس از احراز معتبر اعمال شود و قیمت آزاد همیشه برای عموم قابل انتخاب باشد.",
      "verification": "آزمون مجوز و قیمت نشان دهد کاربر بدون احراز نمی‌تواند نرخ بوعلی را نهایی کند و تغییر احراز در ممیزی ثبت می‌شود."
    },
    {
      "statement": "مشتری بتواند وضعیت رزرو، پرداخت، تحویل و بازگشت را ببیند و در محدودهٔ سیاست، تغییر یا لغو درخواست کند.",
      "verification": "آزمون حساب مشتری دسترسی مالکانه، ثبت درخواست تغییر و منع دسترسی به رزرو دیگران را اثبات کند."
    },
    {
      "statement": "مدیر مجاز بتواند تجهیزات، تصاویر، ظرفیت، پلکان قیمت، تعطیلات، رزروها، پرداخت‌ها و تحویل/بازگشت را مدیریت کند.",
      "verification": "آزمون نقش مدیر همهٔ عملیات مجاز و منع همان عملیات برای مشتری عادی را پوشش دهد."
    },
    {
      "statement": "هر ده قابلیت متمایز در نسخهٔ نهایی به رفتار قابل‌استفاده و قابل‌آزمون تبدیل شوند، نه صرفاً متن رابط.",
      "verification": "طرح اعتبارسنجی برای هر قابلیت حداقل یک سناریوی موفق، یک حالت لبه و یک شاهد قابل‌بازآفرینی داشته باشد."
    },
    {
      "statement": "رابط فارسی راست‌به‌چپ روی موبایل و دسکتاپ، با صفحه‌کلید و فناوری کمکی قابل‌استفاده باشد.",
      "verification": "بازبینی دسترس‌پذیری مسیر مشتری و مدیر شامل ترتیب فوکوس، نام دسترس‌پذیر، کنتراست، خطا و واکنش‌گرایی باشد."
    }
  ],
  "impacts": [
    "architecture",
    "frontend",
    "accessibility",
    "backend",
    "api",
    "integration",
    "database",
    "storage",
    "analytics",
    "security",
    "privacy",
    "identity",
    "observability",
    "performance",
    "resilience",
    "cost",
    "seo",
    "documentation"
  ],
  "constraints": [
    "تصمیم مالک محصول دامنهٔ کامل را الزام می‌کند و کوچک‌سازی به MVP مجاز نیست.",
    "پرداخت واقعی به درگاه دارای قرارداد و راز معتبر نیاز دارد؛ هیچ کلید یا رسید تولیدی نباید در مخزن ذخیره شود.",
    "تاریخ‌های اکسل بدون سال و ساعت به‌عنوان واقعیت تقویم زنده وارد نمی‌شوند.",
    "D1 منبع حقیقت دادهٔ ساختاری و R2 محل فایل و تصویر است؛ browser storage منبع حقیقت رزرو نیست.",
    "ورود ChatGPT هویت را اثبات می‌کند اما مجوز مدیر را اثبات نمی‌کند؛ نقش مدیر باید سمت‌سرور و صریح باشد.",
    "انتشار تولیدی و دسترسی عمومی همچنان دروازهٔ جداگانهٔ انسانی دارند."
  ],
  "nonFunctionalRequirements": [
    {
      "domain": "یکپارچگی رزرو",
      "requirement": "بررسی و مصرف ظرفیت در یک عملیات اتمیک انجام شود و idempotency از ثبت تکراری رزرو یا پرداخت جلوگیری کند.",
      "verification": "آزمون هم‌زمانی و replay با یک کلید یکسان، یک رزرو/پرداخت و ظرفیت غیرمنفی ایجاد کند."
    },
    {
      "domain": "امنیت",
      "requirement": "همهٔ عملیات نوشتن، مالکیت یا نقش را سمت‌سرور بررسی کنند؛ ورودی‌ها اعتبارسنجی و رخدادهای حساس ممیزی شوند.",
      "verification": "آزمون IDOR، ارتقای نقش، ورودی مخرب، CSRF/درخواست تکراری و دسترسی ناشناس رد قابل‌مشاهده تولید کند."
    },
    {
      "domain": "حریم خصوصی",
      "requirement": "فقط حداقل اطلاعات تماس و عملیاتی نگهداری و دادهٔ پرداخت خام یا مدرک حساس در لاگ ثبت نشود.",
      "verification": "بازبینی schema و لاگ‌ها نبود دادهٔ کارت، راز، مدرک خام و PII غیرضروری را اثبات کند."
    },
    {
      "domain": "کارایی",
      "requirement": "فهرست تجهیزات و محاسبهٔ قیمت با شاخص‌های متناسب و پاسخ سمت‌سرور سریع باقی بمانند.",
      "verification": "طرح query با EXPLAIN استفاده از شاخص‌های رزرو/تجهیز/بازه را نشان دهد و بودجهٔ کارایی در staging اندازه‌گیری شود."
    },
    {
      "domain": "بازیابی",
      "requirement": "خطای پرداخت یا تحویل نباید رزرو و سابقهٔ مالی را ناسازگار کند و عملیات قابل retry باشد.",
      "verification": "آزمون شکست میانی، بازپخش امن و وضعیت قابل‌پیگیری بدون از دست‌دادن رکورد را اثبات کند."
    }
  ],
  "evidence": [
    "رزرو و قیمت ها.xlsx#رزرو!A1:F36",
    "رزرو و قیمت ها.xlsx#قیمت ها!A1:D26",
    "workbook/08-discovery.csv#DSC-20260823-001",
    ".product-ops/runtime/approvals.json#APR-D7D4A4195A4F",
    "D:/Projects/BASU-Reservation/basu-rental-app/app/page.tsx",
    "D:/Projects/BASU-Reservation/basu-rental-app/.openai/hosting.json",
    "D:/Projects/BASU-Reservation/basu-rental-app/app/chatgpt-auth.ts"
  ],
  "knownRisks": [
    "سال، ساعت و هویت رزروهای تاریخی منبع مشخص نیست و مهاجرت خودکار آن‌ها می‌تواند تقویم زنده را آلوده کند.",
    "سیاست احراز بوعلی، ودیعه، خسارت، لغو و بازپرداخت هنوز متن حقوقی نهایی ندارد و باید قابل تنظیم باشد.",
    "درگاه پرداخت واقعی و کانال پیامک/اعلان بدون قرارداد و راز معتبر قابل فعال‌سازی تولیدی نیستند.",
    "دامنهٔ کامل چندسطحی است و نبود سناریوی مستقل برای هر ده قابلیت می‌تواند تکمیل ظاهری اما ناقص ایجاد کند.",
    "پیش‌نمایش محلی فعلاً توسط سیاست minimum-release-age وابستگی‌ها متوقف است و هیچ ادعای کامپایل یا رفتار runtime وجود ندارد."
  ],
  "feedbackNote": {
    "learned": "شیت نشان داد مدل واقعی محصول باید دو ماشین وضعیت جدا برای رزرو و پرداخت داشته باشد؛ «تغییر زمان» در ستون پرداخت ثبت شده و انتقال مستقیم این ستون‌ها به یک status واحد، معنای عملیات را خراب می‌کند.",
    "saw": "در شیت رزرو، مقادیر نهایی، پیش‌پرداخت، در حال انتظار و تغییر زمان کنار چند رزرو هم‌روز و تحویل زودهنگام دیده می‌شوند."
  },
  "completedAt": "2026-08-23T13:41:13.996Z"
}
