{
  "schemaVersion": "1.0.0",
  "taskId": "BR-0003",
  "eventId": "EVT-20260823-001",
  "roleId": "RB-03",
  "producerActorId": "actor-rb-03",
  "status": "completed",
  "summary": "اکتشاف رومیزی نشان می‌دهد مسئلهٔ اصلی فقط ساخت یک ویترین نیست، بلکه یکپارچه‌کردن موجودی زمان‌مند، دو نوع قیمت، رزرو، تحویل، پرداخت و عملیات مدیر است. شواهد فعلی برای آماده‌کردن یک تصمیم دربارهٔ دامنهٔ MVP کافی‌اند، اما برای تثبیت قواعد محاسبه و مدل داده باید فایل اکسل منبع یا معادل معتبر آن پیش از قرارداد تحویل بررسی شود.",
  "findings": [
    "منابع معتبر پروژه دو گروه کاربر را مشخص می‌کنند: جامعهٔ دانشگاهی و عموم متقاضیان اجاره برای رویدادها و مناسبت‌ها.",
    "درخواست ثبت‌شده یک مسیر انتهابه‌انتها را صریحاً می‌خواهد: انتخاب تجهیز، تاریخ، ساعت و تعداد، قیمت عمومی یا بوعلی، رزرو، هماهنگی تحویل و پرداخت کامل.",
    "پنل مدیریت باید حداقل موجودی، قیمت‌ها، تعطیلات، رزروها و پرداخت‌ها را پوشش دهد؛ بنابراین هستهٔ مسئله، سازگاری قواعد و وضعیت‌ها میان تجربهٔ مشتری و عملیات مدیر است.",
    "ذکر تاریخ، ساعت، تعداد و تعطیلات نشان می‌دهد موجودی باید بر اساس بازهٔ زمانی و ظرفیت ارزیابی شود، نه فقط یک پرچم موجود یا ناموجود؛ این یک استنباط طراحی برای بررسی است، نه قاعدهٔ کسب‌وکار تأییدشده.",
    "دو جست‌وجوی مستقل در D:/Projects/BASU-Reservation هیچ فایل xlsx یا xls و هیچ فایل دارای نام رزرو یا قیمت پیدا نکرد؛ منبع اکسل اشاره‌شده در محیط فعلی قابل بررسی نیست.",
    "هیچ مصاحبه، مشاهدهٔ کاربر، تحلیل تراکنش یا آزمون قابلیت استفاده انجام نشده است؛ ادعای تقاضا، ترجیح یا نرخ موفقیت کاربر وجود ندارد."
  ],
  "recommendations": [
    "برای تصمیم بعدی، MVP به یک مسیر کامل رزرو و یک مسیر کامل مدیریت محدود شود و ده قابلیت متمایز به‌عنوان بستهٔ مستقل اولویت‌بندی شوند، نه شرط شروع همهٔ آن‌ها.",
    "پیش از قرارداد تحویل، فایل اکسل منبع یا خروجی معتبر آن دریافت و قواعد اقلام، واحد اجاره، ظرفیت، قیمت عمومی و بوعلی، تعطیلات، تحویل، لغو و پرداخت استخراج شود.",
    "معیار موفقیت MVP بر تکمیل درست رزرو معتبر و جلوگیری از رزرو نامعتبر متمرکز شود؛ معیارهای رشد یا جذابیت پس از دسترسی به داده یا آزمون کاربر تعیین شوند.",
    "اگر منبع اکسل تا زمان قرارداد تحویل در دسترس نشد، داده‌های نمونه فقط با برچسب مصنوعی و قواعد صریحاً موقت ساخته شوند و هیچ عددی به‌عنوان قیمت واقعی منتشر نشود."
  ],
  "acceptanceCriteria": [
    {
      "statement": "پرسش تصمیم‌ساز اکتشاف، دامنهٔ کوچک‌ترین MVP قابل‌استفاده و اطلاعات لازم برای قواعد رزرو را مشخص کند.",
      "verification": "رکورد DSC-20260823-001 شامل پرسش، روش، یافته‌ها، محدودیت‌ها و توصیهٔ قابل ردیابی باشد."
    },
    {
      "statement": "یافته‌های قطعی از استنباط‌ها و مجهولات جدا شده باشند.",
      "verification": "هر ادعای مربوط به رفتار موجودی یا کاربر یا به منبع ثبت‌شده ارجاع دهد یا صریحاً استنباط/نامعلوم نامیده شود."
    },
    {
      "statement": "نبود فایل اکسل منبع با روش و محدودهٔ جست‌وجو ثبت شده و به نبود قواعد تعبیر نشده باشد.",
      "verification": "محدودیت رکورد، دو جست‌وجوی ناموفق در مسیر پروژه و نیاز به دریافت منبع معتبر را بیان کند."
    },
    {
      "statement": "توصیهٔ اکتشاف برای آماده‌سازی خلاصهٔ تصمیم، بدون تصویب جهت محصول، کفایت کند.",
      "verification": "توصیه گزینهٔ MVP محدود و گزینهٔ دامنهٔ کامل را برای مقایسه آماده کند و اختیار انتخاب را برای مالک محصول نگه دارد."
    }
  ],
  "impacts": [
    "architecture",
    "frontend",
    "accessibility",
    "backend",
    "api",
    "database",
    "analytics",
    "security",
    "privacy",
    "identity",
    "performance",
    "resilience",
    "cost",
    "seo",
    "documentation"
  ],
  "constraints": [
    "منابع اکتشاف فعلی به رکوردهای معتبر همین مخزن محدودند.",
    "نبود فایل اکسل، نبود قاعده را اثبات نمی‌کند و فقط یک شکاف شواهد است.",
    "هیچ دادهٔ واقعی مشتری، قیمت واقعی یا نتیجهٔ پژوهش کاربر در این مرحله ثبت نشده است.",
    "تصمیم دامنه و اولویت فقط با مالک محصول است."
  ],
  "nonFunctionalRequirements": [
    {
      "domain": "یکپارچگی و هم‌زمانی",
      "requirement": "اعتبار رزرو باید با زمان، تعداد، تعطیلی و ظرفیت به‌صورت سازگار بررسی شود و ثبت‌های هم‌زمان نتوانند ظرفیت واحد را دوبار مصرف کنند.",
      "verification": "طرح اعتبارسنجی سناریوهای هم‌پوشانی، رقابت هم‌زمان، تعطیلی و تعداد بیش از ظرفیت را پوشش دهد."
    },
    {
      "domain": "دسترس‌پذیری و بومی‌سازی",
      "requirement": "تجربهٔ فارسی راست‌به‌چپ در موبایل و دسکتاپ، مسیر رزرو قابل‌استفاده با صفحه‌کلید و پیام‌های خطای قابل‌فهم داشته باشد.",
      "verification": "بازبینی RTL، واکنش‌گرایی، فوکوس، برچسب‌ها، کنتراست و پیام خطا در سناریوهای پذیرش ثبت شود."
    },
    {
      "domain": "امنیت و حریم خصوصی",
      "requirement": "مرز دسترسی مشتری و مدیر صریح باشد و اطلاعات رزرو و پرداخت با حداقل‌گرایی داده و ثبت رویدادهای مدیریتی محافظت شوند.",
      "verification": "آزمون مجوزهای نقش، دسترسی مستقیم غیرمجاز، نشت داده و ثبت تغییرات حساس اجرا شود."
    },
    {
      "domain": "کارایی",
      "requirement": "نمایش فهرست تجهیزات و بازخورد محاسبهٔ قیمت در اتصال موبایل معمولی بدون تأخیر آزاردهنده انجام شود.",
      "verification": "بودجهٔ عددی کارایی پس از انتخاب معماری تعیین و در محیط staging اندازه‌گیری شود."
    }
  ],
  "evidence": [
    "events/EVT-20260823-001-event.md",
    ".product-ops/runtime/intake.json",
    "product-ops.config.json",
    "workbook/07-idea-inbox.csv",
    "جست‌وجوی بازگشتی Get-ChildItem برای *.xlsx، *.xls و *.csv در D:/Projects/BASU-Reservation در 2026-08-23",
    "جست‌وجوی مستقل rg --files برای نام‌های رزرو، قیمت، *.xlsx و *.xls در D:/Projects/BASU-Reservation در 2026-08-23"
  ],
  "knownRisks": [
    "قواعد ناشناختهٔ اکسل می‌توانند مدل موجودی، قیمت و وضعیت رزرو را تغییر دهند؛ بازگشایی اکتشاف با دریافت فایل منبع الزامی است.",
    "گسترش هم‌زمان مسیر مشتری، پنل مدیر و ده قابلیت متمایز می‌تواند MVP را از یک خروجی کامل به مجموعه‌ای نیمه‌کاره تبدیل کند.",
    "نحوهٔ احراز قیمت بوعلی، سیاست لغو و بازپرداخت، ودیعه، خسارت و تحویل هنوز تصمیم‌گیری نشده است.",
    "بدون پژوهش کاربر، اولویت‌بندی قابلیت‌های متمایز بر ترجیح واقعی کاربران تکیه ندارد."
  ],
  "canonicalRecords": [
    {
      "sheet": "discovery",
      "key": {
        "discovery_id": "DSC-20260823-001"
      },
      "fields": {
        "event_id": "EVT-20260823-001",
        "idea_id": "IDEA-20260823-001",
        "status": "complete",
        "owner_role": "RB-03",
        "owner_actor_id": "actor-rb-03",
        "question": "کوچک‌ترین دامنهٔ محصولی که می‌تواند رزرو معتبر تجهیزات را برای کاربران هدف و مدیریت عملیاتی را برای مدیر پوشش دهد چیست و کدام قواعد منبع باید پیش از تحویل تثبیت شوند؟",
        "method": "مرور رومیزی رکورد رویداد، intake، پیکربندی پروژه و تریاژ ایده؛ دو جست‌وجوی مستقل فایل برای منبع اکسل؛ بدون پژوهش کاربر یا تحلیل دادهٔ تراکنش.",
        "source_refs": "events/EVT-20260823-001-event.md|.product-ops/runtime/intake.json|product-ops.config.json|workbook/07-idea-inbox.csv",
        "key_findings": "مسئله، یکپارچه‌سازی رزرو زمان‌مند و عملیات مدیر است؛ دو گروه کاربر و دو نوع قیمت ثبت شده‌اند؛ مسیر مشتری و پنج حوزهٔ پنل مدیر در دامنه‌اند؛ رفتار موجودی زمان‌مند یک استنباط برای اعتبارسنجی است؛ پژوهش کاربر انجام نشده است.",
        "limitations": "فایل اکسل اشاره‌شده پس از دو روش جست‌وجو در D:/Projects/BASU-Reservation یافت نشد؛ قیمت‌ها، اقلام، ظرفیت‌ها و قواعد عملیاتی قابل استخراج نبودند. هیچ مصاحبه، دادهٔ واقعی یا آزمون کاربری اجرا نشده است.",
        "recommendation": "خلاصهٔ تصمیم، MVP محدودِ مسیر کامل رزرو و مدیریت را در برابر دامنهٔ کامل مقایسه کند. پیش از قرارداد تحویل، فایل اکسل یا معادل معتبر آن دریافت شود؛ در غیر این صورت فقط داده و قواعد مصنوعیِ صریحاً موقت مجاز باشند.",
        "decision_id": "",
        "producer_actor_id": "actor-rb-03",
        "verifier_actor_id": "actor-rb-12",
        "qc_record_id": "",
        "started_at": "2026-08-23T13:05:17.221Z",
        "completed_at": "2026-08-23T13:07:40.992Z",
        "supersedes_id": ""
      }
    }
  ],
  "feedbackNote": {
    "learned": "در این محصول، ریسک اصلی در شروع کمبود ایدهٔ قابلیت نیست؛ نبود قواعد عملیاتی منبع می‌تواند حتی تعریف موجودی و قیمت را عوض کند.",
    "saw": "درخواست مسیر رزرو و پنج حوزهٔ مدیریت را نام می‌برد، اما دو جست‌وجوی مستقل هیچ فایل اکسل منبعی پیدا نکرد و هیچ قیمت یا قاعدهٔ قابل‌خواندنی در مخزن نبود."
  },
  "completedAt": "2026-08-23T13:07:40.992Z"
}
