{
  "schemaVersion": "1.0.0",
  "taskId": "BR-0006",
  "eventId": "EVT-20260823-001",
  "roleId": "RB-05",
  "producerActorId": "actor-rb-05",
  "status": "completed",
  "summary": "یک مسئلهٔ تحویل واحد و بدون تکرار برای ساخت نسخهٔ نهایی پلتفرم ایجاد شد. مسئله آمادهٔ قرارداد تحویل است، دامنهٔ کامل و ده قابلیت متمایز را حفظ می‌کند و تکمیل یا پیاده‌سازی را ادعا نمی‌کند.",
  "findings": [
    "فرایند فعلی در اکسل اطلاعات قیمت و رزرو را نگه می‌دارد اما موجودی بازه‌ای، کنترل تعارض، هویت مشتری، مجوز مدیر، پرداخت قابل رهگیری، تحویل/بازگشت و ممیزی یکپارچه ندارد.",
    "یافته‌ها یک مسئلهٔ ریشه‌ای مشترک دارند: نبود سامانهٔ تراکنشی واحد برای قیمت‌گذاری، ظرفیت و چرخهٔ کامل اجاره؛ شکستن آن به مسائل مستقل در این مرحله خطر تکرار قرارداد و ناسازگاری مدل را بالا می‌برد.",
    "تصمیم DEC-20260823-001 دامنهٔ کامل شامل ده قابلیت متمایز را تأیید کرده و هیچ تصمیم معلق محصولی برای آماده‌شدن قرارداد تحویل باقی نمانده است.",
    "اجرای محلی فعلاً با کنترل minimum-release-age متوقف است؛ این یک مانع اجرایی موقت است و وضعیت مسئله را از آمادهٔ تحویل به تکمیل‌شده تغییر نمی‌دهد."
  ],
  "recommendations": [
    "قرارداد تحویل یک ticket اصلی با معیارهای قابل ردیابی برای هر حوزه و هر ده قابلیت بسازد و کار مهندسی را به workstreamهای مستقل اما وابسته تقسیم کند.",
    "تحویل، قبل از هر ادعای تکمیل، migration پایگاه‌داده، آزمون قیمت منبع، آزمون رقابت رزرو، امنیت نقش‌ها، پرداخت idempotent و مسیر کامل مشتری/مدیر را اثبات کند.",
    "مانع وابستگی به‌صورت ریسک/شرط ورود ثبت شود و با تغییر نسخه یا دورزدن سیاست بسته نشود."
  ],
  "acceptanceCriteria": [
    {
      "statement": "مسئلهٔ نسخهٔ کامل با تصمیم مالک محصول، شیت منبع و توپولوژی محصول قابل ردیابی باشد.",
      "verification": "ISS-20260823-001 به IDEA-20260823-001، DSC-20260823-001، DEC-20260823-001 و خروجی BR-0005 ارجاع دهد."
    },
    {
      "statement": "مسئله وضعیت ready_for_delivery داشته باشد و هیچ ادعای تکمیل، اعتبارسنجی یا بستن بدون شاهد نکند.",
      "verification": "status برابر ready_for_delivery، result_ids و closure_disposition خالی و ticket مرجع آینده مشخص باشد."
    },
    {
      "statement": "دامنهٔ مورد انتظار مسیر مشتری، مدیر، پرداخت، ذخیره‌سازی، امنیت و ده قابلیت متمایز را بدون کوچک‌سازی نگه دارد.",
      "verification": "expected_behavior و impact با تصمیم ثبت‌شده و خروجی توپولوژی مقایسه شوند."
    }
  ],
  "impacts": [
    "architecture",
    "frontend",
    "accessibility",
    "backend",
    "api",
    "integration",
    "database",
    "storage",
    "analytics",
    "security",
    "privacy",
    "identity",
    "observability",
    "performance",
    "resilience",
    "cost",
    "seo",
    "documentation"
  ],
  "constraints": [
    "دامنهٔ کامل و ادامه تا نقطهٔ انتهایی شرط صریح مالک محصول است.",
    "تکمیل فقط با شواهد runtime، آزمون و verification مستقل قابل ثبت است.",
    "پرداخت تولیدی، رازها و انتشار عمومی مجوزهای جداگانه می‌خواهند.",
    "تاریخ‌های تاریخی فاقد سال/ساعت، تقویم زنده محسوب نمی‌شوند.",
    "سیاست زنجیرهٔ تأمین وابستگی‌ها قابل دورزدن نیست."
  ],
  "nonFunctionalRequirements": [
    {
      "domain": "ردیابی",
      "requirement": "هر معیار قرارداد تحویل به مسئله، تصمیم، شیت منبع و شاهد آزمون متصل باشد.",
      "verification": "lineage نهایی برای هر AC حداقل یک شاهد و یک disposition مستقل داشته باشد."
    },
    {
      "domain": "امنیت",
      "requirement": "هیچ ادعای آماده‌بودن بدون آزمون سمت‌سرور مجوز، مالکیت، idempotency و حفاظت داده پذیرفته نشود.",
      "verification": "گیت امنیت و validation نتایج بازتولیدپذیر داشته باشند."
    },
    {
      "domain": "کیفیت تحویل",
      "requirement": "تمام مسیرهای مشتری و مدیر و هر ده قابلیت در build منتشرشدنی و پایگاه‌دادهٔ migration‌شده وجود داشته باشند.",
      "verification": "build نهایی، migration بازرسی‌شده و مجموعه سناریوهای انتهابه‌انتها عبور کنند."
    }
  ],
  "evidence": [
    "workbook/07-idea-inbox.csv#IDEA-20260823-001",
    "workbook/08-discovery.csv#DSC-20260823-001",
    "workbook/09-decision-log.csv#DEC-20260823-001",
    ".product-ops/runtime/autopilot/product-runs/BR-0005-result.json",
    "رزرو و قیمت ها.xlsx#رزرو!A1:F36",
    "رزرو و قیمت ها.xlsx#قیمت ها!A1:D26"
  ],
  "knownRisks": [
    "فعال‌سازی درگاه پرداخت واقعی بدون قرارداد/راز معتبر ممکن نیست و باید تا آن زمان adapter آزمایشی یا وضعیت پرداخت مدیریتی استفاده شود.",
    "policy حقوقی احراز بوعلی، لغو، بازپرداخت، ودیعه و خسارت هنوز متن نهایی ندارد و باید configuration-driven باشد.",
    "پیش‌نمایش و build هنوز به‌دلیل minimum-release-age اجرا نشده‌اند.",
    "وسعت دامنه نیازمند گیت پوشش صریح برای جلوگیری از جاافتادن یکی از ده قابلیت است."
  ],
  "canonicalRecords": [
    {
      "sheet": "issues",
      "key": {
        "issue_id": "ISS-20260823-001"
      },
      "fields": {
        "event_id": "EVT-20260823-001",
        "title": "ساخت نسخهٔ نهایی پلتفرم یکپارچهٔ اجاره تجهیزات BASU",
        "status": "ready_for_delivery",
        "priority": "P1",
        "risk": "high",
        "source_ids": "IDEA-20260823-001|DSC-20260823-001|DEC-20260823-001|BR-0005",
        "affected_user": "مشتریان عمومی و بوعلی|مدیران عملیات و مالی",
        "current_behavior": "قیمت‌ها و رزروها در دو شیت اکسل نگهداری می‌شوند و کنترل اتمیک موجودی، پرداخت قابل ردیابی، تحویل/بازگشت، حساب مشتری، مجوز مدیر و ممیزی یکپارچه وجود ندارد.",
        "expected_behavior": "نسخهٔ نهایی فارسی و واکنش‌گرا مسیر کامل کشف، قیمت، موجودی، رزرو، پرداخت، تحویل، بازگشت و حساب مشتری را همراه پنل کامل مدیر، دادهٔ پایدار، تصاویر، امنیت، گزارش و ده قابلیت متمایز ارائه کند.",
        "impact": "کاهش تعارض و کار دستی، قیمت‌گذاری شفاف آزاد/بوعلی، کنترل ظرفیت و پرداخت، تجربهٔ سلف‌سرویس مشتری و عملیات قابل ممیزی مدیر در یک سامانهٔ قابل انتشار.",
        "evidence_refs": "رزرو و قیمت ها.xlsx|BR-0005|APR-D7D4A4195A4F",
        "duplicate_of": "",
        "decision_id": "DEC-20260823-001",
        "ticket_ids": "TKT-20260823-001",
        "result_ids": "",
        "closure_disposition": "",
        "owner_role": "RB-05",
        "owner_actor_id": "actor-rb-05",
        "updated_at": "2026-08-23T13:44:47.029Z",
        "supersedes_id": ""
      }
    }
  ],
  "completedAt": "2026-08-23T13:44:47.029Z"
}
