{
  "schemaVersion": "1.0.0",
  "taskId": "BR-0004",
  "eventId": "EVT-20260823-001",
  "roleId": "RB-02",
  "producerActorId": "actor-rb-02",
  "status": "completed",
  "summary": "خلاصهٔ تصمیم سه مسیر متقابلاً متمایز را برای مالک محصول آماده می‌کند: شروع MVP محدود و قابل‌برگشت با دادهٔ موقت، توقف تا دریافت منبع اکسل، یا شروع دامنهٔ کامل. توصیهٔ کارشناسی، مسیر اول با شروط صریح است؛ هیچ گزینه‌ای در این مرحله تصویب نشده است.",
  "findings": [
    "مسئله و مسیر اصلی مشتری و مدیر برای تصمیم دربارهٔ جهت MVP به‌اندازهٔ کافی مشخص شده‌اند.",
    "جزئیات قواعد کسب‌وکار و داده‌های اکسل هنوز در دسترس نیستند و نباید به‌صورت ضمنی در پیاده‌سازی تثبیت شوند.",
    "درخواست ده قابلیت متمایز را می‌خواهد، اما فهرست و اولویت آن‌ها در منبع معتبر ثبت نشده است.",
    "شروع دامنهٔ کامل پیش از تثبیت قواعد، ریسک بازکاری در مدل داده، قیمت‌گذاری و اعتبار رزرو را بالا می‌برد."
  ],
  "recommendations": [
    "مالک محصول مسیر MVP محدود را با شرط استفاده از دادهٔ مصنوعیِ مشخص، عدم انتشار قیمت واقعی و توقف قرارداد تحویل تا دریافت قواعد منبع تأیید کند.",
    "دامنهٔ MVP شامل کاتالوگ تجهیزات، انتخاب تاریخ/ساعت/تعداد، نمایش قیمت عمومی/بوعلی با قواعد موقت، ثبت رزرو، هماهنگی تحویل و وضعیت پرداخت، و پنل مدیریت موجودی/قیمت/تعطیلی/رزرو/پرداخت باشد.",
    "ده قابلیت متمایز در یک مرحلهٔ طراحی جداگانه پیشنهاد و اولویت‌بندی شوند و تنها گزینه‌های منتخب وارد پذیرش نسخهٔ اول شوند.",
    "ساخت مخزن اپلیکیشن جداگانه و انتخاب فناوری فقط پس از تصمیم مالک محصول و با مرز قابل‌برگشت انجام شود."
  ],
  "acceptanceCriteria": [
    {
      "statement": "خلاصهٔ تصمیم یک سؤال واحد با گزینه‌های متقابلاً متمایز برای دامنهٔ ادامهٔ کار ارائه کند.",
      "verification": "decisionProposal شامل سه گزینه و اثر هر گزینه باشد و هیچ گزینه‌ای به‌عنوان تصمیم ثبت نشده باشد."
    },
    {
      "statement": "گزینهٔ پیشنهادی کوچک‌ترین خروجی کامل را از دامنهٔ کامل و از توقف کامل جدا کند.",
      "verification": "اثر گزینهٔ MVP، محدودهٔ جریان مشتری و مدیر، قواعد موقت و شرط بازگشایی با دریافت اکسل را بیان کند."
    },
    {
      "statement": "اختیار انتخاب و شروط تصمیم نزد مالک محصول باقی بماند.",
      "verification": "رکورد DEC-20260823-001 وضعیت pending_human داشته باشد و فیلدهای تصمیم‌گیرنده، گزینهٔ منتخب و زمان تصمیم توسط تولیدکننده پر نشده باشند."
    }
  ],
  "impacts": [
    "architecture",
    "frontend",
    "accessibility",
    "backend",
    "api",
    "database",
    "security",
    "privacy",
    "identity",
    "analytics",
    "performance",
    "resilience",
    "cost",
    "seo",
    "documentation"
  ],
  "constraints": [
    "هیچ گزینه‌ای بدون پاسخ صریح و ثبت‌شدهٔ مالک محصول تصویب نیست.",
    "منبع اکسل در محیط فعلی موجود نیست و هر داده یا قاعدهٔ جایگزین باید مصنوعی و موقت برچسب بخورد.",
    "پرداخت واقعی، انتشار عمومی، تولید و دادهٔ شخصی خارج از مجوز این تصمیم‌اند.",
    "ده قابلیت متمایز هنوز تعریف و اولویت‌بندی نشده‌اند."
  ],
  "nonFunctionalRequirements": [
    {
      "domain": "برگشت‌پذیری",
      "requirement": "مدل و دادهٔ نمونهٔ MVP باید بتوانند پس از دریافت قواعد اکسل بدون مهاجرت مخرب اصلاح شوند.",
      "verification": "قرارداد تحویل، فرض‌های موقت، مرز دادهٔ مصنوعی و برنامهٔ جایگزینی آن‌ها را مشخص کند."
    },
    {
      "domain": "شفافیت قیمت",
      "requirement": "کاربر نوع قیمت و اجزای محاسبه را پیش از ثبت رزرو ببیند و قیمت موقت با قیمت واقعی اشتباه نشود.",
      "verification": "سناریوهای پذیرش برای هر نوع قیمت، برچسب دادهٔ موقت و تغییر قواعد بدون ناسازگاری وجود داشته باشد."
    },
    {
      "domain": "دسترس‌پذیری و موبایل",
      "requirement": "مسیر کامل رزرو فارسی راست‌به‌چپ روی موبایل و با صفحه‌کلید قابل تکمیل باشد.",
      "verification": "طرح اعتبارسنجی شامل RTL، اندازه‌های موبایل، ترتیب فوکوس، نام دسترس‌پذیر و کنتراست باشد."
    }
  ],
  "evidence": [
    "workbook/07-idea-inbox.csv#IDEA-20260823-001",
    "workbook/08-discovery.csv#DSC-20260823-001",
    "events/EVT-20260823-001-event.md",
    ".product-ops/runtime/intake.json"
  ],
  "knownRisks": [
    "شروع با دادهٔ موقت ممکن است فرض‌های نادرست را وارد طراحی کند؛ شرط جایگزینی و بازبینی پیش از تحویل لازم است.",
    "توقف کامل تا دریافت اکسل، یادگیری از تجربهٔ واقعی رابط و جریان رزرو را عقب می‌اندازد.",
    "دامنهٔ کامل از ابتدا احتمال بازکاری، تأخیر و خروجی نیمه‌کاره را افزایش می‌دهد.",
    "انتخاب فناوری و ایجاد مخزن اپلیکیشن هنوز تصمیم و قرارداد ثبت‌شده ندارند."
  ],
  "decisionProposal": {
    "question": "برای ادامهٔ پلتفرم اجاره تجهیزات، کدام دامنه و شرط شروع را تأیید می‌کنید؟",
    "context": "اکتشاف رومیزی مسیر اصلی مشتری و مدیر را روشن کرده، اما فایل اکسل منبع و قواعد واقعی اقلام، قیمت، ظرفیت، تعطیلات، تحویل، لغو و پرداخت در محیط فعلی موجود نیست. این تصمیم فقط جهت و دامنهٔ کار بعدی را تعیین می‌کند و مجوز انتشار تولیدی یا پرداخت واقعی نیست.",
    "options": [
      "شروع MVP محدود با داده و قواعد موقت",
      "توقف تا دریافت فایل اکسل و قواعد واقعی",
      "شروع دامنه کامل شامل ده قابلیت متمایز"
    ],
    "recommendedOption": "شروع MVP محدود با داده و قواعد موقت",
    "recommendationRationale": "این گزینه سریع‌ترین مسیر برگشت‌پذیر برای ساخت یک جریان کامل و آزمودن معماری و تجربهٔ رزرو است، درحالی‌که قیمت‌ها و قواعد ناشناخته را واقعیت تلقی نمی‌کند. شرط آن، برچسب‌گذاری دادهٔ مصنوعی، عدم انتشار عمومی و بازبینی قرارداد تحویل پس از دریافت منبع اکسل است.",
    "optionImpacts": {
      "شروع MVP محدود با داده و قواعد موقت": "ساخت یک جریان کامل مشتری و پنل پایه آغاز می‌شود؛ داده‌ها مصنوعی و موقت‌اند، ده قابلیت جداگانه اولویت‌بندی می‌شوند و پیش از تحویل واقعی قواعد اکسل جایگزین می‌شوند.",
      "توقف تا دریافت فایل اکسل و قواعد واقعی": "ریسک فرض نادرست کمتر می‌شود، اما ساخت و یادگیری رابط متوقف می‌ماند تا منبع معتبر ارائه و بررسی شود.",
      "شروع دامنه کامل شامل ده قابلیت متمایز": "بیشترین دامنه را از ابتدا می‌پذیرد، اما بدون قواعد و اولویت معتبر احتمال بازکاری، تأخیر و ناتمام‌ماندن مسیر اصلی بالاست."
    }
  },
  "canonicalRecords": [
    {
      "sheet": "decision_log",
      "key": {
        "decision_id": "DEC-20260823-001"
      },
      "fields": {
        "event_id": "EVT-20260823-001",
        "title": "انتخاب دامنه و شرط شروع پلتفرم اجاره تجهیزات",
        "status": "pending_human",
        "brief_reference": ".product-ops/runtime/autopilot/product-runs/BR-0004-result.json",
        "evidence_refs": "IDEA-20260823-001|DSC-20260823-001|EVT-20260823-001",
        "risk_acceptance": "none",
        "conditions": "در انتظار تصمیم مالک محصول",
        "supersedes_decision_id": "",
        "resulting_task_ids": "BR-0005|BR-0006|BR-0007|BR-0008|BR-0009|BR-0010|BR-0011|BR-0012|BR-0013|BR-0014"
      }
    }
  ],
  "completedAt": "2026-08-23T13:10:11.097Z"
}
