{
  "schemaVersion": "1.0.0",
  "taskId": "BR-0002",
  "eventId": "EVT-20260823-001",
  "roleId": "RB-02",
  "producerActorId": "actor-rb-02",
  "status": "completed",
  "summary": "ایده برای ادامهٔ اکتشاف واجد شرایط است: مسئله، دو گروه کاربر، جریان رزرو و مرز پنل مدیریت مشخص‌اند؛ اما قواعد موجودی، قیمت‌گذاری، تحویل، پرداخت و دامنهٔ نسخهٔ اول هنوز باید با شواهد و تصمیم مالک محصول تثبیت شوند.",
  "findings": [
    "مسئلهٔ ثبت‌شده، جایگزینی فرایند فعلی مبتنی بر اکسل با تجربهٔ رزرو فارسی و یک پنل مدیریت است.",
    "دو گروه کاربر در وضعیت معتبر پروژه ثبت شده‌اند: جامعهٔ دانشگاهی با تمرکز بر نسل دههٔ ۸۰ به بعد و عموم متقاضیان اجاره برای رویدادها و مناسبت‌ها.",
    "جریان مورد انتظارِ ثبت‌شده شامل انتخاب تجهیز، تاریخ، ساعت و تعداد، محاسبهٔ قیمت عمومی یا بوعلی، رزرو، هماهنگی تحویل و پرداخت کامل است.",
    "درخواست، مدیریت موجودی، قیمت، تعطیلات، رزرو و پرداخت را برای پنل مدیر صریحاً در دامنه قرار داده است.",
    "فایل اکسل اشاره‌شده در درخت فعلی پروژه در دسترس نیست؛ بنابراین هیچ قاعده، قیمت یا موجودی از آن استخراج نشده است."
  ],
  "recommendations": [
    "اکتشاف بعدی ابتدا فایل اکسل منبع و قواعد واقعی رزرو را بررسی کند و فقط شکاف‌هایی را پیگیری کند که بر دامنهٔ نسخهٔ اول یا مدل داده اثر دارند.",
    "نسخهٔ اول بر یک مسیر کامل و برگشت‌پذیر از مشاهدهٔ موجودی تا ثبت رزرو و مدیریت آن متمرکز شود؛ قابلیت‌های متمایز پس از روشن‌شدن مسئله و اولویت رتبه‌بندی شوند.",
    "تفاوت قیمت عمومی و بوعلی، هم‌پوشانی رزروها، تعطیلات، ظرفیت تعداد، لغو، تحویل و وضعیت پرداخت به‌عنوان پرسش‌های تصمیم‌ساز بررسی شوند."
  ],
  "acceptanceCriteria": [
    {
      "statement": "ایده با شناسه، منبع، مسئله، کاربران هدف، نتیجهٔ مورد انتظار، اولویت و مالک تریاژ در صندوق ایده ثبت شده باشد.",
      "verification": "ردیف IDEA-20260823-001 در idea_inbox با رویداد EVT-20260823-001 و منبع معتبر خوانده شود."
    },
    {
      "statement": "هیچ قاعدهٔ قیمت‌گذاری، موجودی یا رفتار محصول بدون شواهد به‌عنوان واقعیت ثبت نشده باشد.",
      "verification": "یافته‌ها و یادداشت ردیف ایده، نبود فایل اکسل و نیاز به اکتشاف را صریح نگه دارند."
    },
    {
      "statement": "تریاژ، ایده را برای اکتشاف بعدی آماده کند و تصمیم محصول را به‌جای مالک محصول نگیرد.",
      "verification": "وضعیت ایده discovery باشد، discovery_id تعیین شده باشد و decision_id خالی بماند."
    }
  ],
  "impacts": [
    "architecture",
    "frontend",
    "accessibility",
    "backend",
    "api",
    "database",
    "security",
    "privacy",
    "identity",
    "analytics",
    "performance",
    "resilience",
    "cost",
    "seo",
    "documentation"
  ],
  "constraints": [
    "رابط اصلی فارسی، راست‌به‌چپ، مینیمال و مدرن باشد.",
    "مالک محصول اختیار نهایی دامنه، اولویت، پذیرش ریسک و تأیید تجربهٔ کاربر را حفظ می‌کند.",
    "تا زمان دسترسی به منبع اکسل، قیمت‌ها، اقلام، ظرفیت‌ها و قواعد عملیاتی فرض نشوند.",
    "هیچ اقدام تولیدی، پرداخت واقعی یا استفاده از دادهٔ شخصی در این مرحله مجاز نیست."
  ],
  "nonFunctionalRequirements": [
    {
      "domain": "دسترس‌پذیری و زبان",
      "requirement": "مسیرهای اصلی رزرو و مدیریت با چیدمان راست‌به‌چپ، متن فارسی خوانا و کنترل‌های قابل‌استفاده با صفحه‌کلید طراحی شوند.",
      "verification": "در طرح اعتبارسنجی، بررسی RTL، ترتیب فوکوس، برچسب کنترل‌ها و کنتراست برای مسیرهای اصلی وجود داشته باشد."
    },
    {
      "domain": "امنیت و حریم خصوصی",
      "requirement": "دسترسی مدیر از مشتری جدا باشد و تنها حداقل دادهٔ لازم برای رزرو و پرداخت نگهداری شود.",
      "verification": "قرارداد تحویل، نقش‌ها، فیلدهای حساس و آزمون‌های منع دسترسی غیرمجاز را مشخص کند."
    },
    {
      "domain": "یکپارچگی رزرو",
      "requirement": "سامانه از ثبت رزرو ناسازگار با ظرفیت و بازهٔ زمانی جلوگیری کند.",
      "verification": "طرح اعتبارسنجی شامل رقابت هم‌زمان، تعداد بیش از ظرفیت، تعطیلی و هم‌پوشانی زمانی باشد."
    }
  ],
  "evidence": [
    "events/EVT-20260823-001-event.md",
    ".product-ops/runtime/intake.json",
    "product-ops.config.json"
  ],
  "knownRisks": [
    "فایل اکسل منبع در پروژه فعلی موجود نیست و ممکن است قواعد مهم عملیاتی هنوز دیده نشده باشند.",
    "عبارت ده قابلیت متمایز بدون رتبه‌بندی می‌تواند دامنهٔ نسخهٔ اول را بیش از حد گسترش دهد.",
    "معنای دقیق قیمت بوعلی و احراز شرایط استفاده از آن هنوز مستند نشده است.",
    "پرداخت کامل، لغو، بازپرداخت، ودیعه و مسئولیت خسارت هنوز قواعد ثبت‌شده ندارند."
  ],
  "canonicalRecords": [
    {
      "sheet": "idea_inbox",
      "key": {
        "idea_id": "IDEA-20260823-001"
      },
      "fields": {
        "event_id": "EVT-20260823-001",
        "submitted_at": "2026-08-23T12:48:13.252Z",
        "submitted_by": "human-product-owner",
        "problem_or_opportunity": "جایگزینی فرایند پراکنده و اکسل‌محور اجاره تجهیزات با یک مسیر فارسی یکپارچه برای مشاهده موجودی، محاسبه قیمت، رزرو، تحویل و پرداخت و یک پنل مدیریت عملیاتی.",
        "target_user": "دانشجوها و انجمن‌های دانشگاهی با تمرکز بر نسل دهه ۸۰ به بعد | عموم متقاضیان اجاره تجهیزات برای رویدادها و مناسبت‌ها",
        "expected_outcome": "کاربر بتواند تجهیز قابل‌اجاره را برای زمان و تعداد معتبر با قیمت مناسب گروه خود رزرو کند و مدیر بتواند موجودی، قیمت، تعطیلات، رزرو و پرداخت را در یک جریان قابل‌پیگیری مدیریت کند.",
        "source_reference": "events/EVT-20260823-001-event.md",
        "status": "discovery",
        "priority": "P1",
        "triage_owner_role": "RB-02",
        "duplicate_of": "",
        "discovery_id": "DSC-20260823-001",
        "decision_id": "",
        "notes": "تریاژ بر اساس درخواست ثبت‌شده و پیکربندی پروژه انجام شد. فایل اکسل منبع در درخت فعلی یافت نشد؛ جزئیات اقلام، قیمت‌ها و قواعد عملیاتی باید در اکتشاف تأیید شوند."
      }
    }
  ],
  "completedAt": "2026-08-23T13:04:41.413Z"
}
